intent,question,answer,category
payment,Как оплатить заказ?,"Оплатить можно картой, по счету или через СБП. Ссылка на оплату приходит после подтверждения заказа.",Оплата
delivery,Когда будет доставка?,Стандартный срок доставки — 1–3 рабочих дня. Статус можно проверить по номеру заказа.,Доставка
documents,Где получить документы?,Закрывающие документы отправляются на email после оплаты. При необходимости менеджер продублирует их вручную.,Документы
work_hours,Какой режим работы?,Поддержка отвечает с 09:00 до 19:00 по Москве. Срочные вопросы передаются оператору.,Режим работы
refund,Как оформить возврат?,Для возврата напишите номер заказа и причину. Оператор проверит заявку и подскажет следующие шаги.,Возврат
